id,title,main_picture,synopsis,mean,rank,popularity,num_list_users,num_scoring_users,start_date,end_date,media_type,status,genres
52991,Sousou no Frieren,"{'medium': 'https://cdn.myanimelist.net/images/anime/1015/138006.webp', 'large': 'https://cdn.myanimelist.net/images/anime/1015/138006l.webp'}","During their decade-long quest to defeat the Demon King, the members of the hero's party—Himmel himself, the priest Heiter, the dwarf warrior Eisen, and the elven mage Frieren—forge bonds through adventures and battles, creating unforgettable precious memories for most of them.

However, the time that Frieren spends with her comrades is equivalent to merely a fraction of her life, which has lasted over a thousand years. When the party disbands after their victory, Frieren casually returns to her ""usual"" routine of collecting spells across the continent. Due to her different sense of time, she seemingly holds no strong feelings toward the experiences she went through.

As the years pass, Frieren gradually realizes how her days in the hero's party truly impacted her. Witnessing the deaths of two of her former companions, Frieren begins to regret having taken their presence for granted; she vows to better understand humans and create real personal connections. Although the story of that once memorable journey has long ended, a new tale is about to begin.

[Written by MAL Rewrite]",9.3,1,142,1125603,664002,2023-09-29,2024-03-22,tv,finished_airing,"['Adventure', 'Drama', 'Fantasy', 'Shounen']"
5114,Fullmetal Alchemist: Brotherhood,"{'medium': 'https://cdn.myanimelist.net/images/anime/1208/94745.webp', 'large': 'https://cdn.myanimelist.net/images/anime/1208/94745l.webp'}","After a horrific alchemy experiment goes wrong in the Elric household, brothers Edward and Alphonse are left in a catastrophic new reality. Ignoring the alchemical principle banning human transmutation, the boys attempted to bring their recently deceased mother back to life. Instead, they suffered brutal personal loss: Alphonse's body disintegrated while Edward lost a leg and then sacrificed an arm to keep Alphonse's soul in the physical realm by binding it to a hulking suit of armor.

The brothers are rescued by their neighbor Pinako Rockbell and her granddaughter Winry. Known as a bio-mechanical engineering prodigy, Winry creates prosthetic limbs for Edward by utilizing ""automail,"" a tough, versatile metal used in robots and combat armor. After years of training, the Elric brothers set off on a quest to restore their bodies by locating the Philosopher's Stone—a powerful gem that allows an alchemist to defy the traditional laws of Equivalent Exchange.

As Edward becomes an infamous alchemist and gains the nickname ""Fullmetal,"" the boys' journey embroils them in a growing conspiracy that threatens the fate of the world.

[Written by MAL Rewrite]",9.1,2,3,3525090,2219022,2009-04-05,2010-07-04,tv,finished_airing,"['Action', 'Adventure', 'Drama', 'Fantasy', 'Military', 'Shounen']"
9253,Steins;Gate,"{'medium': 'https://cdn.myanimelist.net/images/anime/1935/127974.webp', 'large': 'https://cdn.myanimelist.net/images/anime/1935/127974l.webp'}","Eccentric scientist Rintarou Okabe has a never-ending thirst for scientific exploration. Together with his ditzy but well-meaning friend Mayuri Shiina and his roommate Itaru Hashida, Okabe founds the Future Gadget Laboratory in the hopes of creating technological innovations that baffle the human psyche. Despite claims of grandeur, the only notable ""gadget"" the trio have created is a microwave that has the mystifying power to turn bananas into green goo.

However, when Okabe attends a conference on time travel, he experiences a series of strange events that lead him to believe that there is more to the ""Phone Microwave"" gadget than meets the eye. Apparently able to send text messages into the past using the microwave, Okabe dabbles further with the ""time machine,"" attracting the ire and attention of the mysterious organization SERN.

Due to the novel discovery, Okabe and his friends find themselves in an ever-present danger. As he works to mitigate the damage his invention has caused to the timeline, Okabe fights a battle to not only save his loved ones but also to preserve his degrading sanity.

[Written by MAL Rewrite]",9.07,3,14,2700004,1464665,2011-04-06,2011-09-14,tv,finished_airing,"['Drama', 'Psychological', 'Sci-Fi', 'Suspense', 'Time Travel']"
38524,Shingeki no Kyojin Season 3 Part 2,"{'medium': 'https://cdn.myanimelist.net/images/anime/1517/100633.webp', 'large': 'https://cdn.myanimelist.net/images/anime/1517/100633l.webp'}","Seeking to restore humanity's diminishing hope, the Survey Corps embark on a mission to retake Wall Maria, where the battle against the merciless ""Titans"" takes the stage once again.

Returning to the tattered Shiganshina District that was once his home, Eren Yeager and the Corps find the town oddly unoccupied by Titans. Even after the outer gate is plugged, they strangely encounter no opposition. The mission progresses smoothly until Armin Arlert, highly suspicious of the enemy's absence, discovers distressing signs of a potential scheme against them. 

Shingeki no Kyojin Season 3 Part 2 follows Eren as he vows to take back everything that was once his. Alongside him, the Survey Corps strive—through countless sacrifices—to carve a path towards victory and uncover the secrets locked away in the Yeager family's basement.

[Written by MAL Rewrite]",9.05,4,21,2447966,1695834,2019-04-29,2019-07-01,tv,finished_airing,"['Action', 'Drama', 'Gore', 'Military', 'Shounen', 'Survival', 'Suspense']"
28977,Gintama°,"{'medium': 'https://cdn.myanimelist.net/images/anime/3/72078.webp', 'large': 'https://cdn.myanimelist.net/images/anime/3/72078l.webp'}","Gintoki, Shinpachi, and Kagura return as the fun-loving but broke members of the Yorozuya team! Living in an alternate-reality Edo, where swords are prohibited and alien overlords have conquered Japan, they try to thrive on doing whatever work they can get their hands on. However, Shinpachi and Kagura still haven't been paid... Does Gin-chan really spend all that cash playing pachinko?

Meanwhile, when Gintoki drunkenly staggers home one night, an alien spaceship crashes nearby. A fatally injured crew member emerges from the ship and gives Gintoki a strange, clock-shaped device, warning him that it is incredibly powerful and must be safeguarded. Mistaking it for his alarm clock, Gintoki proceeds to smash the device the next morning and suddenly discovers that the world outside his apartment has come to a standstill. With Kagura and Shinpachi at his side, he sets off to get the device fixed; though, as usual, nothing is ever that simple for the Yorozuya team.

Filled with tongue-in-cheek humor and moments of heartfelt emotion, Gintama's fourth season finds Gintoki and his friends facing both their most hilarious misadventures and most dangerous crises yet.

[Written by MAL Rewrite]",9.05,5,343,667998,263777,2015-04-08,2016-03-30,tv,finished_airing,"['Action', 'Comedy', 'Gag Humor', 'Historical', 'Parody', 'Samurai', 'Sci-Fi', 'Shounen']"
39486,Gintama: The Final,"{'medium': 'https://cdn.myanimelist.net/images/anime/1245/116760.jpg', 'large': 'https://cdn.myanimelist.net/images/anime/1245/116760l.jpg'}","Two years have passed following the Tendoshuu's invasion of the O-Edo Central Terminal. Since then, the Yorozuya have gone their separate ways. Foreseeing Utsuro's return, Gintoki Sakata begins surveying Earth's ley lines for traces of the other man's Altana. After an encounter with the remnants of the Tendoshuu—who continue to press on in search of immortality—Gintoki returns to Edo.

Later, the regrouped Shinsengumi and Yorozuya begin an attack on the occupied Central Terminal. With the Altana harvested by the wreckage of the Tendoshuu's ship in danger of detonating, the Yorozuya and their allies fight their enemies while the safety of Edo—and the rest of the world—hangs in the balance. Fulfilling the wishes of their teacher, Shouyou Yoshida's former students unite and relive their pasts one final time in an attempt to save their futures.

[Written by MAL Rewrite]
",9.04,6,1522,169950,80454,2021-01-08,2021-01-08,movie,finished_airing,"['Action', 'Comedy', 'Drama', 'Gag Humor', 'Historical', 'Parody', 'Samurai', 'Sci-Fi', 'Shounen']"
60022,One Piece Fan Letter,"{'medium': 'https://cdn.myanimelist.net/images/anime/1455/146229.webp', 'large': 'https://cdn.myanimelist.net/images/anime/1455/146229l.webp'}","Although the golden age of piracy is about to reach new heights, most people do not seek the glory of finding the elusive One Piece—a treasure signifying a new conqueror of all seas that was once embodied by the legendary King of the Pirates, Gol D. Roger. However, even if civilians generally despise pirates, they secretly cheer for at least one of them. 

One red-headed girl from Sabaody Archipelago is no exception: She reveres Nami, the ingenious female navigator of Monkey D. Luffy's Straw Hat crew. Determined to deliver a fan letter to her idol, the Sabaody child is prepared to challenge forces of authority who strive to prevent Luffy and his friends from departing for their next destination: the New World. But to succeed, Nami's fan may need to risk her life and interfere with the Marines' plans, potentially causing devastating consequences for the wider world.

[Written by MAL Rewrite]",9.04,7,2109,111248,81706,2024-10-20,2024-10-20,tv_special,finished_airing,"['Action', 'Adventure', 'Fantasy', 'Shounen']"
11061,Hunter x Hunter (2011),"{'medium': 'https://cdn.myanimelist.net/images/anime/1337/99013.webp', 'large': 'https://cdn.myanimelist.net/images/anime/1337/99013l.webp'}","Hunters devote themselves to accomplishing hazardous tasks, all from traversing the world's uncharted territories to locating rare items and monsters. Before becoming a Hunter, one must pass the Hunter Examination—a high-risk selection process in which most applicants end up handicapped or worse, deceased.

Ambitious participants who challenge the notorious exam carry their own reason. What drives 12-year-old Gon Freecss is finding Ging, his father and a Hunter himself. Believing that he will meet his father by becoming a Hunter, Gon takes the first step to walk the same path.

During the Hunter Examination, Gon befriends the medical student Leorio Paladiknight, the vindictive Kurapika, and ex-assassin Killua Zoldyck. While their motives vastly differ from each other, they band together for a common goal and begin to venture into a perilous world.

[Written by MAL Rewrite]",9.03,8,8,3026019,1877985,2011-10-02,2014-09-24,tv,finished_airing,"['Action', 'Adventure', 'Fantasy', 'Shounen']"
9969,Gintama',"{'medium': 'https://cdn.myanimelist.net/images/anime/4/50361.webp', 'large': 'https://cdn.myanimelist.net/images/anime/4/50361l.webp'}","After a one-year hiatus, Shinpachi Shimura returns to Edo, only to stumble upon a shocking surprise: Gintoki and Kagura, his fellow Yorozuya members, have become completely different characters! Fleeing from the Yorozuya headquarters in confusion, Shinpachi finds that all the denizens of Edo have undergone impossibly extreme changes, in both appearance and personality. Most unbelievably, his sister Otae has married the Shinsengumi chief and shameless stalker Isao Kondou and is pregnant with their first child.

Bewildered, Shinpachi agrees to join the Shinsengumi at Otae and Kondou's request and finds even more startling transformations afoot both in and out of the ranks of the the organization. However, discovering that Vice Chief Toushirou Hijikata has remained unchanged, Shinpachi and his unlikely Shinsengumi ally set out to return the city of Edo to how they remember it.

With even more dirty jokes, tongue-in-cheek parodies, and shameless references, Gintama' follows the Yorozuya team through more of their misadventures in the vibrant, alien-filled world of Edo.

[Written by MAL Rewrite]",9.02,9,402,590207,248912,2011-04-04,2012-03-26,tv,finished_airing,"['Action', 'Comedy', 'Gag Humor', 'Historical', 'Parody', 'Samurai', 'Sci-Fi', 'Shounen']"
15417,Gintama': Enchousen,"{'medium': 'https://cdn.myanimelist.net/images/anime/1452/123686.webp', 'large': 'https://cdn.myanimelist.net/images/anime/1452/123686l.webp'}","While Gintoki Sakata was away, the Yorozuya found themselves a new leader: Kintoki, Gintoki's golden-haired doppelganger. In order to regain his former position, Gintoki will need the help of those around him, a troubling feat when no one can remember him! Between Kintoki and Gintoki, who will claim the throne as the main character?

In addition, Yorozuya make a trip back down to red-light district of Yoshiwara to aid an elderly courtesan in her search for her long-lost lover. Although the district is no longer in chains beneath the earth's surface, the trio soon learn of the tragic backstories of Yoshiwara's inhabitants that still haunt them. With flashback after flashback, this quest has Yorozuya witnessing everlasting love and protecting it as best they can with their hearts and souls.

[Written by MAL Rewrite]",9.02,10,751,345707,173556,2012-10-04,2013-03-28,tv,finished_airing,"['Action', 'Comedy', 'Gag Humor', 'Historical', 'Parody', 'Samurai', 'Sci-Fi', 'Shounen']"
820,Ginga Eiyuu Densetsu,"{'medium': 'https://cdn.myanimelist.net/images/anime/1976/142016.webp', 'large': 'https://cdn.myanimelist.net/images/anime/1976/142016l.webp'}","The 150-year-long stalemate between the two interstellar superpowers, the Galactic Empire and the Free Planets Alliance, comes to an end when a new generation of leaders arises: the idealistic military genius Reinhard von Lohengramm, and the FPA's reserved historian, Yang Wenli.

While Reinhard climbs the ranks of the Empire with the aid of his childhood friend, Siegfried Kircheis, he must fight not only the war, but also the remnants of the crumbling Goldenbaum Dynasty in order to free his sister from the Kaiser and unify humanity under one genuine ruler. Meanwhile, on the other side of the galaxy, Yang—a strong supporter of democratic ideals—has to stand firm in his beliefs, despite the struggles of the FPA, and show his pupil, Julian Mintz, that autocracy is not the solution.

As ideologies clash amidst the war's many casualties, the two strategic masterminds must ask themselves what the real reason behind their battle is.

[Written by MAL Rewrite]",9.01,11,754,344692,84102,1988-01-08,1997-03-17,ova,finished_airing,"['Adult Cast', 'Drama', 'Military', 'Sci-Fi', 'Space']"
41467,Bleach: Sennen Kessen-hen,"{'medium': 'https://cdn.myanimelist.net/images/anime/1908/135431.webp', 'large': 'https://cdn.myanimelist.net/images/anime/1908/135431l.webp'}","Substitute Soul Reaper Ichigo Kurosaki spends his days fighting against Hollows, dangerous evil spirits that threaten Karakura Town. Ichigo carries out his quest with his closest allies: Orihime Inoue, his childhood friend with a talent for healing; Yasutora Sado, his high school classmate with superhuman strength; and Uryuu Ishida, Ichigo's Quincy rival.

Ichigo's vigilante routine is disrupted by the sudden appearance of Asguiaro Ebern, a dangerous Arrancar who heralds the return of Yhwach, an ancient Quincy king. Yhwach seeks to reignite the historic blood feud between Soul Reaper and Quincy, and he sets his sights on erasing both the human world and the Soul Society for good.

Yhwach launches a two-pronged invasion into both the Soul Society and Hueco Mundo, the home of Hollows and Arrancar. In retaliation, Ichigo and his friends must fight alongside old allies and enemies alike to end Yhwach's campaign of carnage before the world itself comes to an end.

[Written by MAL Rewrite]",9.0,12,366,637753,338727,2022-10-11,2022-12-27,tv,finished_airing,"['Action', 'Adventure', 'Shounen', 'Supernatural']"
34096,Gintama.,"{'medium': 'https://cdn.myanimelist.net/images/anime/3/83528.webp', 'large': 'https://cdn.myanimelist.net/images/anime/3/83528l.webp'}","After joining the resistance against the bakufu, Gintoki and the gang are in hiding, along with Katsura and his Joui rebels. The Yorozuya is soon approached by Nobume Imai and two members of the Kiheitai, who explain that the Harusame pirates have turned against 7th Division Captain Kamui and their former ally Takasugi. The Kiheitai present Gintoki with a job: find Takasugi, who has been missing since his ship was ambushed in a Harusame raid. Nobume also makes a stunning revelation regarding the Tendoushuu, a secret organization pulling the strings of numerous factions, and their leader Utsuro, the shadowy figure with an uncanny resemblance to Gintoki's former teacher.

Hitching a ride on Sakamoto's space ship, the Yorozuya and Katsura set out for Rakuyou, Kagura's home planet, where the various factions have gathered and tensions are brewing. Long-held grudges, political infighting, and the Tendoushuu's sinister overarching plan finally culminate into a massive, decisive battle on Rakuyou.

[Written by MAL Rewrite]",8.98,13,781,335409,154193,2017-01-09,2017-03-27,tv,finished_airing,"['Action', 'Comedy', 'Gag Humor', 'Historical', 'Parody', 'Samurai', 'Sci-Fi', 'Shounen']"
43608,Kaguya-sama wa Kokurasetai: Ultra Romantic,"{'medium': 'https://cdn.myanimelist.net/images/anime/1160/122627.webp', 'large': 'https://cdn.myanimelist.net/images/anime/1160/122627l.webp'}","The elite members of Shuchiin Academy's student council continue their competitive day-to-day antics. Council president Miyuki Shirogane clashes daily against vice-president Kaguya Shinomiya, each fighting tooth and nail to trick the other into confessing their romantic love. Kaguya struggles within the strict confines of her wealthy, uptight family, rebelling against her cold default demeanor as she warms to Shirogane and the rest of her friends.

Meanwhile, council treasurer Yuu Ishigami suffers under the weight of his hopeless crush on Tsubame Koyasu, a popular upperclassman who helps to instill a new confidence in him. Miko Iino, the newest student council member, grows closer to the rule-breaking Ishigami while striving to overcome her own authoritarian moral code.

As love further blooms at Shuchiin Academy, the student council officers drag their outsider friends into increasingly comedic conflicts.

[Written by MAL Rewrite]
",8.98,14,167,1032019,585197,2022-04-09,2022-06-25,tv,finished_airing,"['Comedy', 'Romance', 'School', 'Seinen']"
42938,Fruits Basket: The Final,"{'medium': 'https://cdn.myanimelist.net/images/anime/1085/114792.webp', 'large': 'https://cdn.myanimelist.net/images/anime/1085/114792l.webp'}","Hundreds of years ago, the Chinese zodiac spirits and their god swore to stay together eternally. United by this promise, the possessed members of the Souma family shall always return to each other under any circumstances. Yet, when these bonds shackle them from freedom, it becomes an undesirable burden—a curse. As head of the clan, Akito is convinced that he shares a special connection with the other Soumas. While he desperately clings to this fantasy, the rest of the family remains isolated and suppressed by the fear of punishment.

Tooru Honda, who has grown attached to the Soumas, is determined to break the chains that bind them. Her companionship with the family and her friends encourages her to move forward with lifting the curse. However, due to confounding revelations, she struggles to find the tenacity to continue her endeavors. With time slowly withering away, Tooru contends with an uncertain future in hopes of reaching the tranquility that may lie beyond all this commotion.

[Written by MAL Rewrite]",8.95,15,456,528353,261915,2021-04-06,2021-06-29,tv,finished_airing,"['Drama', 'Romance', 'Shoujo', 'Supernatural']"
4181,Clannad: After Story,"{'medium': 'https://cdn.myanimelist.net/images/anime/1299/110774.jpg', 'large': 'https://cdn.myanimelist.net/images/anime/1299/110774l.jpg'}","Tomoya Okazaki and Nagisa Furukawa have graduated from high school, and together, they experience the emotional rollercoaster of growing up. Unable to decide on a course for his future, Tomoya learns the value of a strong work ethic and discovers the strength of Nagisa's support. Through the couple's dedication and unity of purpose, they push forward to confront their personal problems, deepen their old relationships, and create new bonds.

Time also moves on in the Illusionary World. As the plains grow cold with the approach of winter, the Illusionary Girl and the Garbage Doll are presented with a difficult situation that reveals the World's true purpose.

[Written by MAL Rewrite]",8.93,16,120,1244642,681554,2008-10-03,2009-03-27,tv,finished_airing,"['Drama', 'Romance']"
918,Gintama,"{'medium': 'https://cdn.myanimelist.net/images/anime/10/73274.webp', 'large': 'https://cdn.myanimelist.net/images/anime/10/73274l.webp'}","Edo is a city that was home to the vigor and ambition of samurai across the country. However, following feudal Japan's surrender to powerful aliens known as the ""Amanto,"" those aspirations now seem unachievable. With the once-influential shogunate rebuilt as a puppet government, a new law is passed that promptly prohibits all swords in public. 

Enter Gintoki Sakata, an eccentric silver-haired man who always carries around a wooden sword and maintains his stature as a samurai despite the ban. As the founder of Yorozuya, a small business for odd jobs, Gintoki often embarks on endeavors to help other people—though usually in rather strange and unforeseen ways. 

Assisted by Shinpachi Shimura, a boy with glasses supposedly learning the way of the samurai; Kagura, a tomboyish girl with superhuman strength and an endless appetite; and Sadaharu, their giant pet dog who loves biting on people's heads, the Yorozuya encounter anything from alien royalty to scuffles with local gangs in the ever-changing world of Edo.

[Written by MAL Rewrite]",8.93,17,147,1116902,411894,2006-04-04,2010-03-25,tv,finished_airing,"['Action', 'Comedy', 'Gag Humor', 'Historical', 'Parody', 'Samurai', 'Sci-Fi', 'Shounen']"
28851,Koe no Katachi,"{'medium': 'https://cdn.myanimelist.net/images/anime/1122/96435.jpg', 'large': 'https://cdn.myanimelist.net/images/anime/1122/96435l.jpg'}","As a wild youth, elementary school student Shouya Ishida sought to beat boredom in the cruelest ways. When the deaf Shouko Nishimiya transfers into his class, Shouya and the rest of his class thoughtlessly bully her for fun. However, when her mother notifies the school, he is singled out and blamed for everything done to her. With Shouko transferring out of the school, Shouya is left at the mercy of his classmates. He is heartlessly ostracized all throughout elementary and middle school, while teachers turn a blind eye.

Now in his third year of high school, Shouya is still plagued by his wrongdoings as a young boy. Sincerely regretting his past actions, he sets out on a journey of redemption: to meet Shouko once more and make amends.

Koe no Katachi tells the heartwarming tale of Shouya's reunion with Shouko and his honest attempts to redeem himself, all while being continually haunted by the shadows of his past.
 
[Written by MAL Rewrite]",8.93,18,20,2481711,1709894,2016-09-17,2016-09-17,movie,finished_airing,"['Award Winning', 'Drama', 'Shounen']"
35180,3-gatsu no Lion 2nd Season,"{'medium': 'https://cdn.myanimelist.net/images/anime/3/88469.webp', 'large': 'https://cdn.myanimelist.net/images/anime/3/88469l.webp'}","Now in his second year of high school, Rei Kiriyama continues pushing through his struggles in the professional shogi world as well as his personal life. Surrounded by vibrant personalities at the shogi hall, the school club, and in the local community, his solitary shell slowly begins to crack. Among them are the three Kawamoto sisters—Akari, Hinata, and Momo—who forge an affectionate and familial bond with Rei. Through these ties, he realizes that everyone is burdened by their own emotional hardships and begins learning how to rely on others while supporting them in return. 

Nonetheless, the life of a professional is not easy. Between tournaments, championships, and title matches, the pressure mounts as Rei advances through the ranks and encounters incredibly skilled opponents. As he manages his relationships with those who have grown close to him, the shogi player continues to search for the reason he plays the game that defines his career.

[Written by MAL Rewrite]",8.91,19,589,424345,208735,2017-10-14,2018-03-31,tv,finished_airing,"['Childcare', 'Drama', 'Seinen', 'Strategy Game']"
2904,Code Geass: Hangyaku no Lelouch R2,"{'medium': 'https://cdn.myanimelist.net/images/anime/1088/135089.webp', 'large': 'https://cdn.myanimelist.net/images/anime/1088/135089l.webp'}","One year has passed since the Black Rebellion, a failed uprising against the Holy Britannian Empire led by the masked vigilante Zero, who is now missing. At a loss without their revolutionary leader, Area 11's resistance group—the Black Knights—find themselves too powerless to combat the brutality inflicted upon the Elevens by Britannia, which has increased significantly in order to crush any hope of a future revolt. 

Lelouch Lamperouge, having lost all memory of his double life, is living peacefully alongside his friends as a high school student at Ashford Academy. His former partner C.C., unable to accept this turn of events, takes it upon herself to remind him of his past purpose, hoping that the mastermind Zero will rise once again to finish what he started, in this thrilling conclusion to the series.

[Written by MAL Rewrite]
",8.91,20,47,1874443,1248543,2008-04-06,2008-09-28,tv,finished_airing,"['Action', 'Award Winning', 'Drama', 'Mecha', 'Military', 'Sci-Fi', 'Super Power']"
