id,title,main_picture,synopsis,mean,rank,popularity,num_list_users,num_scoring_users,start_date,end_date,media_type,status,genres
15335,Gintama Movie 2: Kanketsu-hen - Yorozuya yo Eien Nare,"{'medium': 'https://cdn.myanimelist.net/images/anime/10/51723.webp', 'large': 'https://cdn.myanimelist.net/images/anime/10/51723l.webp'}","When Gintoki apprehends a movie pirate at a premiere, he checks the camera's footage and finds himself transported to a bleak, post-apocalyptic version of Edo, where a mysterious epidemic called the ""White Plague"" has ravished the world's population. It turns out that the movie pirate wasn't a pirate after all—it was an android time machine, and Gintoki has been hurtled five years into the future! Shinpachi and Kagura, his Yorozuya cohorts, have had a falling out and are now battle-hardened solo vigilantes and he himself has been missing for years, disappearing without a trace after scribbling a strange message in his journal.

Setting out in the disguise given to him by the android time machine, Gintoki haphazardly reunites the Yorozuya team to investigate the White Plague, and soon discovers that the key to saving the future lies in the darkness of his own past. Determined to confront a powerful foe, he makes an important discovery—with a ragtag band of friends and allies at his side, he doesn't have to fight alone.

[Written by MAL Rewrite]",8.9,21,1035,254516,140952,2013-07-06,2013-07-06,movie,finished_airing,"['Action', 'Comedy', 'Gag Humor', 'Historical', 'Parody', 'Samurai', 'Sci-Fi', 'Shounen', 'Time Travel']"
19,Monster,"{'medium': 'https://cdn.myanimelist.net/images/anime/10/18793.webp', 'large': 'https://cdn.myanimelist.net/images/anime/10/18793l.webp'}","Dr. Kenzou Tenma, an elite neurosurgeon recently engaged to his hospital director's daughter, is well on his way to ascending the hospital hierarchy. That is until one night, a seemingly small event changes Dr. Tenma's life forever. While preparing to perform surgery on someone, he gets a call from the hospital director telling him to switch patients and instead perform life-saving brain surgery on a famous performer. His fellow doctors, fiancée, and the hospital director applaud his accomplishment; but because of the switch, a poor immigrant worker is dead, causing Dr. Tenma to have a crisis of conscience.

So when a similar situation arises, Dr. Tenma stands his ground and chooses to perform surgery on the young boy Johan Liebert instead of the town's mayor. Unfortunately, this choice leads to serious ramifications for Dr. Tenma—losing his social standing being one of them. However, with the mysterious death of the director and two other doctors, Dr. Tenma's position is restored. With no evidence to convict him, he is released and goes on to attain the position of hospital director. 

Nine years later when Dr. Tenma saves the life of a criminal, his past comes back to haunt him—once again, he comes face to face with the monster he operated on. He must now embark on a quest of pursuit to make amends for the havoc spread by the one he saved.

[Written by MAL Rewrite]",8.89,22,122,1234441,468831,2004-04-07,2005-09-28,tv,finished_airing,"['Adult Cast', 'Drama', 'Mystery', 'Psychological', 'Seinen', 'Suspense']"
37491,Gintama. Shirogane no Tamashii-hen - Kouhan-sen,"{'medium': 'https://cdn.myanimelist.net/images/anime/1776/96566.webp', 'large': 'https://cdn.myanimelist.net/images/anime/1776/96566l.webp'}","Following the temporary retreat of the Altana Liberation Army from the Kabuki District, the state of the war has seemingly improved. However, as the Oniwaban, Shinsengumi, and residents of the district combat the army's remnants, Edo's greatest inventor Gengai Hiraga is abducted. Responsible for causing the enemy's withdrawal by rendering their weapons useless, Gengai's nanomachine virus is now at risk of being shut down.

Meanwhile, a laser capable of obliterating a planet is activated in Earth's orbit on the Liberation Army's mother ship. Another battle ensues when Shinsuke Takasugi and the rest of the Kiheitai arrive on the vessel to stop the weapon from firing. Forced to fight a war on two fronts, the Yorozuya and their allies must prevail on both sides to save Edo and the rest of the world.

[Written by MAL Rewrite]
",8.88,23,1222,215823,102473,2018-07-09,2018-10-08,tv,finished_airing,"['Action', 'Comedy', 'Gag Humor', 'Historical', 'Parody', 'Samurai', 'Sci-Fi', 'Shounen']"
54492,Kusuriya no Hitorigoto,"{'medium': 'https://cdn.myanimelist.net/images/anime/1708/138033.jpg', 'large': 'https://cdn.myanimelist.net/images/anime/1708/138033l.jpg'}","Maomao, an apothecary's daughter, has been plucked from her peaceful life and sold to the lowest echelons of the imperial court. Now merely a maid, Maomao settles into her new mundane life and hides her extensive knowledge of medicine in order to avoid any unwanted attention.

Not long after Maomao's arrival, the emperor's infant children inexplicably begin to experience grave symptoms—almost as if a curse has been cast. The curious Maomao easily solves the mystery and, to remain out of the limelight, attempts to leave an anonymous tip. Unfortunately, the dashing and perceptive eunuch Jinshi sees through it and manages to single her out.

In recognition of her talent, Maomao is promoted to lady-in-waiting for the emperor's favorite concubine, Gyokuyou. As Maomao continues to remedy the numerous ailments afflicting the imperial court, her pharmaceutical expertise quickly proves indispensable.

[Written by MAL Rewrite]",8.87,24,365,640195,342501,2023-10-22,2024-03-24,tv,finished_airing,"['Drama', 'Historical', 'Medical', 'Mystery']"
35247,Owarimonogatari 2nd Season,"{'medium': 'https://cdn.myanimelist.net/images/anime/6/87322.webp', 'large': 'https://cdn.myanimelist.net/images/anime/6/87322l.webp'}","Following an encounter with oddity specialist Izuko Gaen, third-year high school student Koyomi Araragi wakes up in a strange, deserted void only to be greeted by a joyfully familiar face in an alarmingly unfamiliar place.  

Araragi, with the help of his girlfriend Hitagi Senjougahara, maneuvers through the webs of his past and the perplexities of the present in search of answers. However, fate once again delivers him to the eccentric transfer student Ougi Oshino, who brings forth an unexpected proposal that may unearth the very foundation to which he is anchored. As Araragi peels back the layers of mystery surrounding an apparition, he discovers a truth not meant to be revealed.

[Written by MAL Rewrite]",8.86,25,592,422354,203305,2017-08-12,2017-08-13,tv_special,finished_airing,"['Comedy', 'Mystery', 'Supernatural', 'Vampire']"
51535,Shingeki no Kyojin: The Final Season - Kanketsu-hen,"{'medium': 'https://cdn.myanimelist.net/images/anime/1279/131078.jpg', 'large': 'https://cdn.myanimelist.net/images/anime/1279/131078l.jpg'}","In the wake of Eren Yeager's cataclysmic actions, his friends and former enemies form an alliance against his genocidal rampage. Though once bitter foes, Armin Arlert, Mikasa Ackerman, and the remaining members of the Scout Regiment join forces with Reiner Braun and the survivors of the Marleyan military. Their meager united front sets out on a mission to stop Eren's wrath and—if possible—save their old comrade in the process.

As Eren pushes forward at any cost, he battles his own internal turmoil. Although he feels immense remorse over his horrific invasion, Eren believes he harbors noble intentions: he believes the path ahead is the only way to save his friends and, to a greater extent, his people.

The opposing battalions spiral toward an inevitable final clash that may claim the lives of millions. Though they face an army of monsters beyond anything they could have previously imagined, Mikasa, Armin, and their allies stand brave in the face of certain doom.

[Written by MAL Rewrite]",8.86,26,278,770836,461905,2023-03-04,2023-11-05,tv_special,finished_airing,"['Action', 'Drama', 'Gore', 'Military', 'Shounen', 'Survival', 'Suspense']"
37987,Violet Evergarden Movie,"{'medium': 'https://cdn.myanimelist.net/images/anime/1825/110716.jpg', 'large': 'https://cdn.myanimelist.net/images/anime/1825/110716l.jpg'}","Several years have passed since the end of The Great War. As the radio tower in Leidenschaftlich continues to be built, telephones will soon become more relevant, leading to a decline in demand for ""Auto Memory Dolls."" Even so, Violet Evergarden continues to rise in fame after her constant success with writing letters. However, sometimes the one thing you long for is the one thing that does not appear.

Violet Evergarden Movie follows Violet as she continues to comprehend the concept of emotion and the meaning of love. At the same time, she pursues a glimmer of hope that the man who once told her, ""I love you,"" may still be alive even after the many years that have passed.

[Written by MAL Rewrite]",8.85,27,339,676828,311326,2020-09-18,2020-09-18,movie,finished_airing,"['Award Winning', 'Drama']"
58514,Kusuriya no Hitorigoto 2nd Season,"{'medium': 'https://cdn.myanimelist.net/images/anime/1025/147458.jpg', 'large': 'https://cdn.myanimelist.net/images/anime/1025/147458l.jpg'}","Using her wit and vast knowledge of medicines and poisons alike, Maomao played a pivotal role in solving a series of mysteries and conspiracies that plagued the imperial court. Having recently come to terms with the secrets of her parents, she returns to fulfill her normal duties on behalf of the emperor's highest-ranking consorts. Maomao also works alongside the eunuch Jinshi to better the consorts' many ladies-in-waiting, including helping them learn to read.

However, with the arrival of a merchant caravan comes a new wave of intrigue. A pattern of strange coincidences involving the visitors and their wares unsettles Maomao, driving her to investigate the puzzling circumstances behind the convoy. As dangers from both outside and within threaten the balance between the imperial concubines, Maomao continues to utilize her cunning and medical expertise to keep the women safe from harm.

[Written by MAL Rewrite]",8.85,28,881,301980,62482,2025-01-10,2025-06-27,tv,currently_airing,"['Drama', 'Historical', 'Medical', 'Mystery']"
32281,Kimi no Na wa.,"{'medium': 'https://cdn.myanimelist.net/images/anime/5/87048.webp', 'large': 'https://cdn.myanimelist.net/images/anime/5/87048l.webp'}","Mitsuha Miyamizu, a high school girl, yearns to live the life of a boy in the bustling city of Tokyo—a dream that stands in stark contrast to her present life in the countryside. Meanwhile in the city, Taki Tachibana lives a busy life as a high school student while juggling his part-time job and hopes for a future in architecture.

One day, Mitsuha awakens in a room that is not her own and suddenly finds herself living the dream life in Tokyo—but in Taki's body! Elsewhere, Taki finds himself living Mitsuha's life in the humble countryside. In pursuit of an answer to this strange phenomenon, they begin to search for one another.

Kimi no Na wa. revolves around Mitsuha and Taki's actions, which begin to have a dramatic impact on each other's lives, weaving them into a fabric held together by fate and circumstance.

[Written by MAL Rewrite]",8.83,29,11,2899228,1999637,2016-08-26,2016-08-26,movie,finished_airing,"['Award Winning', 'Drama']"
40682,Kingdom 3rd Season,"{'medium': 'https://cdn.myanimelist.net/images/anime/1443/111830.webp', 'large': 'https://cdn.myanimelist.net/images/anime/1443/111830l.webp'}","Following the successful Sanyou campaign, the Qin army, including 1,000-Man Commander Xin, inches ever closer to fulfilling King Ying Zheng's dream of unifying China. With a major geographical foothold in the state of Wei now under its control, Qin sets its sights eastward toward the remaining warring states.

Meanwhile Li Mu—an unparalleled strategist and the newly appointed prime minister of the state of Zhao—has taken advantage of Zhao's temporary truce with Qin to negotiate with the other states without interruption. Seemingly without warning, Ying Zheng receives news that armies from the states of Chu, Zhao, Wei, Han, Yan, and Qi have crossed into Qin territory. Realizing too late the purpose behind Li Mu's truce with Qin, Zheng quickly gathers his advisors to devise a plan to address the six-state coalition army on their doorstep. For the first time in history, the state of Qin faces complete destruction and must use every resource and strategy at their disposal to prevent themselves from being wiped off the map.

[Written by MAL Rewrite]
",8.83,30,1977,120780,47994,2020-04-06,2021-10-17,tv,finished_airing,"['Action', 'Historical', 'Military', 'Seinen']"
59571,Shingeki no Kyojin Movie: Kanketsu-hen - The Last Attack,"{'medium': 'https://cdn.myanimelist.net/images/anime/1379/145452.webp', 'large': 'https://cdn.myanimelist.net/images/anime/1379/145452l.webp'}",A compilation movie for Shingeki no Kyojin: The Final Season - Kanketsu-hen.,8.82,31,3464,47827,15083,2024-11-08,2024-11-08,movie,finished_airing,"['Action', 'Drama', 'Gore', 'Military', 'Shounen', 'Survival', 'Suspense']"
49387,Vinland Saga Season 2,"{'medium': 'https://cdn.myanimelist.net/images/anime/1170/124312.webp', 'large': 'https://cdn.myanimelist.net/images/anime/1170/124312l.webp'}","After his father's death and the destruction of his village at the hands of English raiders, Einar wishes for a peaceful life with his family on their newly rebuilt farms. However, fate has other plans: his village is invaded once again. Einar watches helplessly as the marauding Danes burn his lands and slaughter his family. The invaders capture Einar and take him back to Denmark as a slave. 

Einar clings to his mother's final words to survive. He is purchased by Ketil, a kind slave owner and landlord who promises that Einar can regain his freedom in return for working in the fields. Soon, Einar encounters his new partner in farm cultivation—Thorfinn, a dejected and melancholic slave. As Einar and Thorfinn work together toward their freedom, they are haunted by both sins of the past and the ploys of the present. Yet they carry on, grasping for a glimmer of hope, redemption, and peace in a world that is nothing but unjust and unforgiving.

[Written by MAL Rewrite]",8.81,32,292,748146,409774,2023-01-10,2023-06-20,tv,finished_airing,"['Action', 'Adventure', 'Drama', 'Gore', 'Historical', 'Seinen']"
36838,Gintama. Shirogane no Tamashii-hen,"{'medium': 'https://cdn.myanimelist.net/images/anime/12/89603.webp', 'large': 'https://cdn.myanimelist.net/images/anime/12/89603l.webp'}","After the fierce battle on Rakuyou, the untold past and true goal of the immortal Naraku leader, Utsuro, are finally revealed. By corrupting the Altana reserves of several planets, Utsuro has successfully triggered the intervention of the Tendoshuu’s greatest enemy: the Altana Liberation Army. With Earth as the main battleground in this interplanetary war, Utsuro's master plan to destroy the planet—and himself—is nearly complete. 

An attack on the O-Edo Central Terminal marks the beginning of the final battle to take back the land of the samurai. With the Yorozuya nowhere in sight, the bakufu all but collapsed, and the Shogun missing, the people are left completely helpless as the Liberation Army begins pillaging Edo in the name of freeing them from the Tendoshuu's rule. 

Caught in the crossfire between two equally imposing forces, can Gintoki, Kagura, Shinpachi, and the former students of Shouyou Yoshida put aside their differences and unite their allies to protect what they hold dear?

[Written by MAL Rewrite]",8.81,33,1160,228573,111229,2018-01-08,2018-03-26,tv,finished_airing,"['Action', 'Comedy', 'Gag Humor', 'Historical', 'Parody', 'Samurai', 'Sci-Fi', 'Shounen']"
263,Hajime no Ippo,"{'medium': 'https://cdn.myanimelist.net/images/anime/4/86334.jpg', 'large': 'https://cdn.myanimelist.net/images/anime/4/86334l.jpg'}","In his father's absence, teenager Ippo Makunouchi works hard to help his mother run her fishing boat rental business. Ippo's timid nature, his lack of sleep, and the sea smell make him an easy target for relentless bullies who leave him bruised and beaten on a daily basis. Mamoru Takamura, an up-and-coming boxer, rescues Ippo from a violent after-school incident and takes him back to the Kamogawa Boxing Gym for recovery. Takamura and his fellow boxers, Masaru Aoki and Tatsuya Kimura, are stunned by Ippo's powerful punches—a result of strong muscles developed through years serving his physically taxing family business. 

Following brief training under Takamura, Ippo impresses the other boxers in a practice match against prodigy Ichirou Miyata. He gains a rival in Miyata and a coach in Genji Kamogawa, the gym owner and a former boxer himself. As Ippo takes the first steps in his official boxing career, he faces off against a series of challenging opponents, each more powerful than the last. Victory, loss, and a cycle of dedicated training await Ippo on his journey to achieve greatness. With his tough body and unstoppable fighting spirit, the kind young man seeks to take on the world.

[Written by MAL Rewrite]
",8.78,34,356,651137,320784,2000-10-04,2002-03-27,tv,finished_airing,"['Combat Sports', 'Shounen', 'Sports']"
40028,Shingeki no Kyojin: The Final Season,"{'medium': 'https://cdn.myanimelist.net/images/anime/1000/110531.webp', 'large': 'https://cdn.myanimelist.net/images/anime/1000/110531l.webp'}","Gabi Braun and Falco Grice have been training their entire lives to inherit one of the seven Titans under Marley's control and aid their nation in eradicating the Eldians on Paradis. However, just as all seems well for the two cadets, their peace is suddenly shaken by the arrival of Eren Yeager and the remaining members of the Survey Corps.

Having finally reached the Yeager family basement and learned about the dark history surrounding the Titans, the Survey Corps has at long last found the answer they so desperately fought to uncover. With the truth now in their hands, the group set out for the world beyond the walls.

In Shingeki no Kyojin: The Final Season, two utterly different worlds collide as each party pursues its own agenda in the long-awaited conclusion to Paradis' fight for freedom.

[Written by MAL Rewrite]",8.78,35,31,2157967,1431865,2020-12-07,2021-03-29,tv,finished_airing,"['Action', 'Drama', 'Gore', 'Military', 'Shounen', 'Survival', 'Suspense']"
31758,Kizumonogatari III: Reiketsu-hen,"{'medium': 'https://cdn.myanimelist.net/images/anime/1084/112813.jpg', 'large': 'https://cdn.myanimelist.net/images/anime/1084/112813l.jpg'}","After helping revive the legendary vampire Kiss-shot Acerola-orion Heart-under-blade, Koyomi Araragi has become a vampire himself and her servant. Kiss-shot is certain she can turn him back into a human, but only once regaining her full power. 

Araragi has hunted down the three vampire hunters that defeated Kiss-shot and retrieved her limbs to return her to full strength. However, now that Araragi has almost accomplished what he’s been fighting for this whole time, he has to consider if this is what he really wants. Once he revives this powerful immortal vampire, there is no telling what she might do, and there would be no way of stopping her.

But there is more to the story that Araragi doesn’t understand. If a newborn vampire like him could defeat the hunters, how did they overpower Kiss-shot? Can he trust her to turn him back to a human? And how is that even possible in the first place?

Araragi is at his limit but he must come to a decision, and it may not be possible to resolve this situation without doing something he’ll regret…

[Written by MAL Rewrite]",8.78,36,497,492276,286256,2017-01-06,2017-01-06,movie,finished_airing,"['Action', 'Mystery', 'Supernatural', 'Vampire']"
37510,Mob Psycho 100 II,"{'medium': 'https://cdn.myanimelist.net/images/anime/1918/96303.webp', 'large': 'https://cdn.myanimelist.net/images/anime/1918/96303l.webp'}","Shigeo ""Mob"" Kageyama is now maturing and understanding his role as a supernatural psychic that has the power to drastically affect the livelihood of others. He and his mentor Reigen Arataka continue to deal with supernatural requests from clients, whether it be exorcizing evil spirits or tackling urban legends that haunt the citizens.

While the workflow remains the same, Mob isn't just blindly following Reigen around anymore. With all his experiences as a ridiculously strong psychic, Mob's supernatural adventures now have more weight to them. Things take on a serious and darker tone as the dangers Mob and Reigen face are much more tangible and unsettling than ever before.

[Written by MAL Rewrite]",8.78,37,73,1641988,1034800,2019-01-07,2019-04-01,tv,finished_airing,"['Action', 'Comedy', 'Supernatural']"
32935,Haikyuu!! Karasuno Koukou vs. Shiratorizawa Gakuen Koukou,"{'medium': 'https://cdn.myanimelist.net/images/anime/7/81992.webp', 'large': 'https://cdn.myanimelist.net/images/anime/7/81992l.webp'}","After the victory against Aoba Jousai High, Karasuno High School, once called “a fallen powerhouse, a crow that can’t fly,” has finally reached the climax of the heated Spring tournament. Now, to advance to nationals, the Karasuno team has to defeat the powerhouse Shiratorizawa Academy. Karasuno’s greatest hurdle is their adversary’s ace, Wakatoshi Ushijima, the number one player in the Miyagi Prefecture, and one of the country’s top three aces.

Only the strongest team will make it to the national tournament. Since this match is the third-year players’ last chance to qualify for nationals, Karasuno has to use everything they learned during the training camp and prior matches to attain victory. Filled with restlessness and excitement, both teams are determined to come out on top in the third season of Haikyuu!!.

[Written by MAL Rewrite] ",8.77,38,116,1275449,841680,2016-10-08,2016-12-10,tv,finished_airing,"['School', 'Shounen', 'Sports', 'Team Sports']"
199,Sen to Chihiro no Kamikakushi,"{'medium': 'https://cdn.myanimelist.net/images/anime/6/79597.webp', 'large': 'https://cdn.myanimelist.net/images/anime/6/79597l.webp'}","Stubborn, spoiled, and naïve, 10-year-old Chihiro Ogino is less than pleased when she and her parents discover an abandoned amusement park on the way to their new house. Cautiously venturing inside, she realizes that there is more to this place than meets the eye, as strange things begin to happen once dusk falls. Ghostly apparitions and food that turns her parents into pigs are just the start—Chihiro has unwittingly crossed over into the spirit world. Now trapped, she must summon the courage to live and work amongst spirits, with the help of the enigmatic Haku and the cast of unique characters she meets along the way.

Vivid and intriguing, Sen to Chihiro no Kamikakushi tells the story of Chihiro's journey through an unfamiliar world as she strives to save her parents and return home.

[Written by MAL Rewrite]",8.77,39,44,1951710,1362260,2001-07-20,2001-07-20,movie,finished_airing,"['Adventure', 'Award Winning', 'Fantasy', 'Mythology']"
37521,Vinland Saga,"{'medium': 'https://cdn.myanimelist.net/images/anime/1500/103005.webp', 'large': 'https://cdn.myanimelist.net/images/anime/1500/103005l.webp'}","Young Thorfinn grew up listening to the stories of old sailors that had traveled the ocean and reached the place of legend, Vinland. It's said to be warm and fertile, a place where there would be no need for fighting—not at all like the frozen village in Iceland where he was born, and certainly not like his current life as a mercenary. War is his home now. Though his father once told him, ""You have no enemies, nobody does. There is nobody who it's okay to hurt,"" as he grew, Thorfinn knew that nothing was further from the truth.

The war between England and the Danes grows worse with each passing year. Death has become commonplace, and the viking mercenaries are loving every moment of it. Allying with either side will cause a massive swing in the balance of power, and the vikings are happy to make names for themselves and take any spoils they earn along the way. Among the chaos, Thorfinn must take his revenge and kill Askeladd, the man who murdered his father. The only paradise for the vikings, it seems, is the era of war and death that rages on.

[Written by MAL Rewrite]",8.77,40,70,1680948,973651,2019-07-08,2019-12-30,tv,finished_airing,"['Action', 'Adventure', 'Drama', 'Gore', 'Historical', 'Seinen']"
48583,Shingeki no Kyojin: The Final Season Part 2,"{'medium': 'https://cdn.myanimelist.net/images/anime/1948/120625.webp', 'large': 'https://cdn.myanimelist.net/images/anime/1948/120625l.webp'}","Turning against his former allies and enemies alike, Eren Yeager sets a disastrous plan in motion. Under the guidance of the Beast Titan, Zeke, Eren takes extreme measures to end the ancient conflict between Marley and Eldia—but his true intentions remain a mystery. Delving deep into his family's past, Eren fights to control his own destiny.

Meanwhile, the long-feuding nations of Marley and Eldia utilize both soldiers and Titans in a brutal race to eliminate the other. Reiner Braun uses his own powers in a desperate bid to hold off Eren's own militaristic force, and his fellow Eldians—children Falco Grice and Gabi Braun—struggle to survive in the unfolding chaos.

Elsewhere, Eren's childhood friends Mikasa Ackerman and Armin Arlert remain imprisoned alongside Eren's former Survey Corps companions, all disturbed by Eren's monstrous transformation. Under the blind belief that Eren still secretly harbors good intentions, Mikasa and the others enter the fray in an attempt to save their friend's very soul.

[Written by MAL Rewrite]
",8.76,41,97,1441120,849699,2022-01-10,2022-04-04,tv,finished_airing,"['Action', 'Drama', 'Gore', 'Military', 'Shounen', 'Survival', 'Suspense']"
