id,title,main_picture,synopsis,mean,rank,popularity,num_list_users,num_scoring_users,start_date,end_date,media_type,status,genres
17074,Monogatari Series: Second Season,"{'medium': 'https://cdn.myanimelist.net/images/anime/1807/121534.webp', 'large': 'https://cdn.myanimelist.net/images/anime/1807/121534l.webp'}","Apparitions, oddities, and gods continue to manifest around Koyomi Araragi and his close-knit group of friends: Tsubasa Hanekawa, the group's modest genius; Shinobu Oshino, the resident doughnut-loving vampire; athletic deviant Suruga Kanbaru; bite-happy spirit Mayoi Hachikuji; Koyomi's cute admirer Nadeko Sengoku; and Hitagi Senjougahara, Koyomi's eclectic girlfriend.

A new semester has begun and with graduation looming over Koyomi, he must quickly decide the paths he will walk, as well as the relationships he will form and friends that he will save. But as strange events begin to unfold, Koyomi is nowhere to be found, and a vicious tiger apparition has appeared in his absence. Hanekawa has become its target, and she quickly finds she must fend for herself.

[Written by MAL Rewrite]",8.76,42,318,699682,370941,2013-07-07,2013-12-29,tv,finished_airing,"['Comedy', 'Mystery', 'Romance', 'Supernatural', 'Vampire']"
51009,Jujutsu Kaisen 2nd Season,"{'medium': 'https://cdn.myanimelist.net/images/anime/1792/138022.webp', 'large': 'https://cdn.myanimelist.net/images/anime/1792/138022l.webp'}","The year is 2006, and the halls of Tokyo Prefectural Jujutsu High School echo with the endless bickering and intense debate between two inseparable best friends. Exuding unshakeable confidence, Satoru Gojou and Suguru Getou believe there is no challenge too great for young and powerful Special Grade sorcerers such as themselves. They are tasked with safely delivering a sensible girl named Riko Amanai to the entity whose existence is the very essence of the jujutsu world. However, the mission plunges them into an exhausting swirl of moral conflict that threatens to destroy the already feeble amity between sorcerers and ordinary humans.

Twelve years later, students and sorcerers are the frontline defense against the rising number of high-level curses born from humans' negative emotions. As the entities grow in power, their self-awareness and ambition increase too. The curses unite for the common goal of eradicating humans and creating a world of only cursed energy users, led by a dangerous, ancient cursed spirit. To dispose of their greatest obstacle—the strongest sorcerer, Gojou—they orchestrate an attack at Shibuya Station on Halloween. Dividing into teams, the sorcerers enter the fight prepared to risk everything to protect the innocent and their own kind.

[Written by MAL Rewrite]",8.75,43,129,1194394,678879,2023-07-06,2023-12-28,tv,finished_airing,"['Action', 'Gore', 'School', 'Shounen', 'Supernatural']"
2921,Ashita no Joe 2,"{'medium': 'https://cdn.myanimelist.net/images/anime/3/45028.webp', 'large': 'https://cdn.myanimelist.net/images/anime/3/45028l.webp'}","Yabuki Joe is left downhearted and hopeless after a certain tragic event. In attempt to put the past behind him, Joe leaves the gym behind and begins wandering. On his travels he comes across the likes of Wolf Kanagushi and Goromaki Gondo, men who unintentionally fan the dying embers inside him, leading him to putting his wanderings to an end. His return home puts Joe back on the path to boxing, but unknown to himself and his trainer, he now suffers deep-set issues holding him back from fighting. In attempt to quell those issues, Carlos Rivera, a world renowned boxer is invited from Venezuela to help Joe recover.",8.75,44,3027,61668,23819,1980-10-13,1981-08-31,tv,finished_airing,"['Combat Sports', 'Drama', 'Shounen', 'Sports']"
47917,Bocchi the Rock!,"{'medium': 'https://cdn.myanimelist.net/images/anime/1448/127956.jpg', 'large': 'https://cdn.myanimelist.net/images/anime/1448/127956l.jpg'}","Yearning to make friends and perform live with a band, lonely and socially anxious Hitori ""Bocchi"" Gotou devotes her time to playing the guitar. On a fateful day, Bocchi meets the outgoing drummer Nijika Ijichi, who invites her to join Kessoku Band when their guitarist, Ikuyo Kita, flees before their first show. Soon after, Bocchi meets her final bandmate—the cool bassist Ryou Yamada. 

Although their first performance together is subpar, the girls feel empowered by their shared love for music, and they are soon rejoined by Kita. Finding happiness in performing, Bocchi and her bandmates put their hearts into improving as musicians while making the most of their fleeting high school days.

[Written by MAL Rewrite]",8.75,45,319,697634,419726,2022-10-09,2022-12-25,tv,finished_airing,"['CGDCT', 'Comedy', 'Music']"
55690,Boku no Kokoro no Yabai Yatsu 2nd Season,"{'medium': 'https://cdn.myanimelist.net/images/anime/1643/138581.jpg', 'large': 'https://cdn.myanimelist.net/images/anime/1643/138581l.jpg'}","After an eventful winter break, Kyoutarou Ichikawa and Anna Yamada reunite with a stronger bond. They continue to grow in their own ways, with Yamada taking on more challenging photoshoots and Ichikawa maturing both physically and emotionally as he tackles his affections for Yamada. However, spending time together outside of school allows for their relationship to deepen, and it becomes increasingly difficult to deny their budding romantic feelings.

Grappling with these unexpected and new emotions, Ichikawa and Yamada realize that, with the passage of time, their relationship is bound to change—and they must ultimately decide whether they wish to remain close friends or finally become a couple.

[Written by MAL Rewrite]",8.75,46,1004,263989,147013,2024-01-07,2024-03-31,tv,finished_airing,"['Comedy', 'Romance', 'School', 'Shounen']"
1,Cowboy Bebop,"{'medium': 'https://cdn.myanimelist.net/images/anime/4/19644.webp', 'large': 'https://cdn.myanimelist.net/images/anime/4/19644l.webp'}","Crime is timeless. By the year 2071, humanity has expanded across the galaxy, filling the surface of other planets with settlements like those on Earth. These new societies are plagued by murder, drug use, and theft, and intergalactic outlaws are hunted by a growing number of tough bounty hunters.

Spike Spiegel and Jet Black pursue criminals throughout space to make a humble living. Beneath his goofy and aloof demeanor, Spike is haunted by the weight of his violent past. Meanwhile, Jet manages his own troubled memories while taking care of Spike and the Bebop, their ship. The duo is joined by the beautiful con artist Faye Valentine, odd child Edward Wong Hau Pepelu Tivrusky IV, and Ein, a bioengineered Welsh corgi.

While developing bonds and working to catch a colorful cast of criminals, the Bebop crew's lives are disrupted by a menace from Spike's past. As a rival's maniacal plot continues to unravel, Spike must choose between life with his newfound family or revenge for his old wounds.

[Written by MAL Rewrite]",8.75,47,42,1971851,1017643,1998-04-03,1999-04-24,tv,finished_airing,"['Action', 'Adult Cast', 'Award Winning', 'Sci-Fi', 'Space']"
52198,Kaguya-sama wa Kokurasetai: First Kiss wa Owaranai,"{'medium': 'https://cdn.myanimelist.net/images/anime/1670/130060.webp', 'large': 'https://cdn.myanimelist.net/images/anime/1670/130060l.webp'}","After their first kiss, Kaguya Shinomiya and Miyuki Shirogane are left unsure where their relationship stands. The troubling uncertainty of whether they could be considered an official couple unleashes newfound problems as both Kaguya and Shirogane struggle to sort out their feelings.

While the lovestruck student council officers fret, the Christmas season rolls around, and romance is in the air. In the face of widespread tenderness, Kaguya and Shirogane must endure their affectionate battle of wits once more. Should they reconcile their feelings for one another, they may find themselves within reach of what they have both been longing for so long: true love.

[Written by MAL Rewrite]",8.74,48,793,329638,183419,2022-12-17,2022-12-17,movie,finished_airing,"['Comedy', 'Drama', 'Romance', 'School', 'Seinen']"
58567,Ore dake Level Up na Ken Season 2: Arise from the Shadow,"{'medium': 'https://cdn.myanimelist.net/images/anime/1448/147351.jpg', 'large': 'https://cdn.myanimelist.net/images/anime/1448/147351l.jpg'}","Sung Jin-Woo, dubbed the weakest hunter of all mankind, grows stronger by the day with the supernatural powers he has gained. However, keeping his skills hidden becomes more difficult as dungeon-related incidents pile up around him.

When Jin-Woo and a few other low-ranked hunters are the only survivors of a dungeon that turns out to be a bigger challenge than initially expected, he draws attention once again, and hunter guilds take an increased interest in him. Meanwhile, a strange hunter who has been lost for ten years returns with a dire warning about an upcoming catastrophic event. As the calamity looms closer, Jin-Woo must continue leveling up to make sure nothing stops him from reaching his ultimate goal—saving the life of his mother.

[Written by MAL Rewrite]",8.74,49,406,586985,344393,2025-01-05,2025-03-30,tv,finished_airing,"['Action', 'Adult Cast', 'Adventure', 'Fantasy', 'Urban Fantasy']"
50160,Kingdom 4th Season,"{'medium': 'https://cdn.myanimelist.net/images/anime/1566/122794.jpg', 'large': 'https://cdn.myanimelist.net/images/anime/1566/122794l.jpg'}","Following the conclusion of the large-scale coalition campaign, the entirety of China is in a state of economic recovery. The victor of the battle, the state of Qin, is no different. There, the political parties led by Ying Zheng and Buwei Lü continue their inner conflict. Having played the role of king in the coalition battle, Zheng has the trust of the people—but Lü is far from out of the fight. In 18 months, he plans to interrupt Zheng's coming-of-age ceremony.

Meanwhile, a Zhao army numbering 20,000 troops has set out toward Qin. In the royal court, due to the lack of generals capable of responding to the incoming threat, Lü slyly suggests that Zheng take command. However, Cheng Jiao, Zheng's half-brother, volunteers instead. As they grew to trust each other during the coalition battle, Zheng now accepts Jiao as his replacement.

However, the Zhao forces retreat a mere half-day after clashing with Jiao's army. With trouble quickly brewing in the shadows, the internal struggle of Qin is only complicated further. There are only two men Zheng feels he can rely on: Bi, a general who commands 30,000 men; and Xin, the leader of the Fei Xin force.

[Written by MAL Rewrite]
",8.73,50,2619,79079,34149,2022-04-10,2022-10-02,tv,finished_airing,"['Action', 'Historical', 'Military', 'Seinen']"
21,One Piece,"{'medium': 'https://cdn.myanimelist.net/images/anime/1244/138851.jpg', 'large': 'https://cdn.myanimelist.net/images/anime/1244/138851l.jpg'}","Barely surviving in a barrel after passing through a terrible whirlpool at sea, carefree Monkey D. Luffy ends up aboard a ship under attack by fearsome pirates. Despite being a naive-looking teenager, he is not to be underestimated. Unmatched in battle, Luffy is a pirate himself who resolutely pursues the coveted One Piece treasure and the King of the Pirates title that comes with it.

The late King of the Pirates, Gol D. Roger, stirred up the world before his death by disclosing the whereabouts of his hoard of riches and daring everyone to obtain it. Ever since then, countless powerful pirates have sailed dangerous seas for the prized One Piece only to never return. Although Luffy lacks a crew and a proper ship, he is endowed with a superhuman ability and an unbreakable spirit that make him not only a formidable adversary but also an inspiration to many.

As he faces numerous challenges with a big smile on his face, Luffy gathers one-of-a-kind companions to join him in his ambitious endeavor, together embracing perils and wonders on their once-in-a-lifetime adventure.

[Written by MAL Rewrite]",8.73,51,17,2533510,1439852,1999-10-20,,tv,currently_airing,"['Action', 'Adventure', 'Fantasy', 'Shounen']"
45649,The First Slam Dunk,"{'medium': 'https://cdn.myanimelist.net/images/anime/1745/129284.jpg', 'large': 'https://cdn.myanimelist.net/images/anime/1745/129284l.jpg'}","Shohoku's ""speedster"" and point guard, Ryouta Miyagi, always plays with brains and lightning speed, running circles around his opponents while feigning composure. Born and raised in Okinawa, Ryouta had a brother who was three years older. Following in the footsteps of his older brother, who was a famous local player from a young age, Ryouta also became addicted to basketball.

In his second year of high school, Ryouta plays with the Shohoku High School basketball team along with Sakuragi, Rukawa, Akagi, and Mitsui as they take the stage at the Inter-High School National Championship. And now, they are on the brink of challenging the reigning champions, Sannoh Kogyo High School.

(Source: GKIDS, edited)",8.73,52,2926,65617,29509,2022-12-03,2022-12-03,movie,finished_airing,"['Award Winning', 'School', 'Shounen', 'Sports', 'Team Sports']"
44074,Shiguang Dailiren,"{'medium': 'https://cdn.myanimelist.net/images/anime/1135/114867.jpg', 'large': 'https://cdn.myanimelist.net/images/anime/1135/114867l.jpg'}","It is said that a picture is worth a thousand words. In this case, it holds an infinite amount of secrets. These are secrets that only Cheng Xiaoshi and Lu Guang are able to find. In a small shop called ""Time Photo Studio,"" the two friends provide a special service: using their extraordinary powers that let them enter photographs, they jump into pictures brought to them by clients in order to grant their wishes. Through the eyes of the photographer, they live through the events surrounding the picture and try to decipher how to solve their client's request.

But every time they jump into a picture, they take a great risk. One wrong move and they could alter the future of the person who took the picture... and possibly countless other events too. So when the events they are forced to live through in these pictures start to become personal, it will take the utmost strength to push their feelings aside and focus on accomplishing the task they were paid to do.

[Written by MAL Rewrite]",8.72,53,570,436128,168943,2021-04-30,2021-07-09,ona,finished_airing,"['Adult Cast', 'Drama', 'Mystery', 'Super Power', 'Suspense', 'Time Travel']"
47778,Kimetsu no Yaiba: Yuukaku-hen,"{'medium': 'https://cdn.myanimelist.net/images/anime/1908/120036.webp', 'large': 'https://cdn.myanimelist.net/images/anime/1908/120036l.webp'}","The devastation of the Mugen Train incident still weighs heavily on the members of the Demon Slayer Corps. Despite being given time to recover, life must go on, as the wicked never sleep: a vicious demon is terrorizing the alluring women of the Yoshiwara Entertainment District. The Sound Hashira, Tengen Uzui, and his three wives are on the case. However, when he soon loses contact with his spouses, Tengen fears the worst and enlists the help of Tanjirou Kamado, Zenitsu Agatsuma, and Inosuke Hashibira to infiltrate the district's most prominent houses and locate the depraved Upper Rank Demon.

[Written by MAL Rewrite]",8.72,54,76,1602183,1021281,2021-12-05,2022-02-13,tv,finished_airing,"['Action', 'Historical', 'Shounen', 'Supernatural']"
53223,Kingdom 5th Season,"{'medium': 'https://cdn.myanimelist.net/images/anime/1050/139641.webp', 'large': 'https://cdn.myanimelist.net/images/anime/1050/139641l.webp'}",Fifth season of Kingdom.,8.72,55,3360,50798,21469,2024-01-14,2024-03-31,tv,finished_airing,"['Action', 'Historical', 'Military', 'Seinen']"
24701,Mushishi Zoku Shou 2nd Season,"{'medium': 'https://cdn.myanimelist.net/images/anime/9/68095.webp', 'large': 'https://cdn.myanimelist.net/images/anime/9/68095l.webp'}","Ghostly, primordial beings known as Mushi continue to cause mysterious changes in the lives of humans. The travelling Mushishi, Ginko, persists in trying to set right the strange and unsettling situations he encounters. Time loops, living shadows, and telepathy are among the overt effects of interference from Mushi, but more subtle symptoms that take years to be noticed also rouse Ginko's concern as he passes from village to village.

Through circumstance, Ginko has become an arbiter, determining which Mushi are blessings and which are curses. But the lines that he seeks to draw are subjective. Some of his patients would rather exercise their new powers until they are utterly consumed by them; others desperately strive to rid themselves of afflictions which are in fact protecting their lives from devastation. Those who cross paths with Mushi must learn to accept seemingly impossible consequences for their actions, and heal wounds they did not know they had. Otherwise, they risk meeting with fates beyond their comprehension.

[Written by MAL Rewrite]",8.72,56,931,282673,112640,2014-10-19,2014-12-21,tv,finished_airing,"['Adult Cast', 'Adventure', 'Historical', 'Iyashikei', 'Mystery', 'Seinen', 'Slice of Life', 'Supernatural']"
48569,86 Part 2,"{'medium': 'https://cdn.myanimelist.net/images/anime/1321/117508.jpg', 'large': 'https://cdn.myanimelist.net/images/anime/1321/117508l.jpg'}","The disappearance of the Spearhead Squadron beyond the horizon does little to hide the intensity of the Republic of San Magnolia's endless propaganda. Vladilena Milizé continues to operate as ""Handler One,"" the commander of yet another dehumanized 86th faction's squadron in the continuous war against the Legion.

On the Western Front, Shinei Nouzen and his squad are quarantined in a military base controlled by the Federal Republic of Giad, formerly known as the Giadian Empire. The newly-established government grants the saved Eighty-Six full citizenship and freedom. Housed by the president Ernst Zimmerman himself, the group meets his adoptive daughter and the last Empress, Augusta Frederica Adel-Adler.

However, within the calm of this tender society, Shinei and his team feel that their purpose is on the battlefield. Before long, they are once again in the midst of the Legion's onslaught as a part of the Federacy's Nordlicht Squadron, accompanied by Augusta Frederica. But, as history repeats itself, they realize that no matter the side, death and pain on the front lines are the only comfort they know.

[Written by MAL Rewrite]",8.72,57,410,581069,334195,2021-10-03,2022-03-19,tv,finished_airing,"['Action', 'Drama', 'Mecha', 'Military', 'Sci-Fi']"
39894,Hibike! Euphonium 3,"{'medium': 'https://cdn.myanimelist.net/images/anime/1216/142086.jpg', 'large': 'https://cdn.myanimelist.net/images/anime/1216/142086l.jpg'}","With the ensemble contest behind them, the members of the Kitauji High School concert band now aim to win a gold medal at the national competition. For third-year club president Kumiko Oumae and her friends, it is their last chance before graduation. Filled with anticipation and anxiety, Kumiko worries if she can successfully lead the band.

Amid her struggles, Kumiko encounters transfer student Mayu Kuroe. From her gentle demeanor to her talented euphonium skills, Mayu was a member of the Seira Girls' School concert band—a regular at nationals. While Mayu is friendly, Kumiko cannot help but have an indescribable feeling from their meeting.

As new members arrive and plans are set in motion, the club, with an insatiable hunger for a gold medal, learns what it truly takes to propel themselves to reach the national level.

[Written by MAL Rewrite]",8.72,58,2477,86726,32313,2024-04-07,2024-06-30,tv,finished_airing,"['Drama', 'Music', 'School']"
52215,Chi. Chikyuu no Undou ni Tsuite,"{'medium': 'https://cdn.myanimelist.net/images/anime/1749/145922.webp', 'large': 'https://cdn.myanimelist.net/images/anime/1749/145922l.webp'}","Twelve-year-old prodigy Rafal believes in living rationally, so as to earn praise and respect from society while not being led astray by his emotions. To this end, he publicly states his intention to study theology—the academic field held in highest regard in early 15th century Poland. However, an encounter with a mysterious man upends Rafal's life, sparking an illogical desire to instead pursue his passion for astronomy.

Rafal is determined to prove the beauty and rationality of heliocentrism—the theory that the Earth revolves around the Sun. This belief is considered heretical by the powerful Church, which promotes geocentrism—the Sun revolving around the Earth—as the sole truth of the universe. Those whose beliefs do not align with the will of the Church suffer unfathomably gruesome consequences.

In pursuit of evidence for a heliocentric model of the universe, Rafal grapples with obtaining precise calculations and building empirical theories. His greatest challenge, however, lies in conducting this research discreetly—lest he wish to meet the same fate as other heretics.

[Written by MAL Rewrite]",8.71,59,1282,203867,71394,2024-10-05,2025-03-15,tv,finished_airing,"['Drama', 'Historical', 'Seinen']"
50172,Mob Psycho 100 III,"{'medium': 'https://cdn.myanimelist.net/images/anime/1228/125011.webp', 'large': 'https://cdn.myanimelist.net/images/anime/1228/125011l.webp'}","After foiling a world-threatening plot, Shigeo ""Mob"" Kageyama returns to tackle the more exhausting aspects of his mundane life—starting with filling out his school's nerve-racking career form. Meanwhile, he continues to assist his mentor Arataka Reigen and the office's new recruit, Katsuya Serizawa, in solving paranormal cases of their clients. While continuing his duties, Mob also works on gaining more independence in his esper and human lives, as well as trying to integrate better with the people around him.

However, new supernatural and ordinary challenges test Mob’s emotional stability and force him to confront the realities around him. As he strives to continue forward on the path to maturity, Mob must resolve his emotional crises and reassess the naivety he has held on for so long.

[Written by MAL Rewrite]",8.71,60,269,783057,394697,2022-10-06,2022-12-22,tv,finished_airing,"['Action', 'Comedy', 'Supernatural']"
44,Rurouni Kenshin: Meiji Kenkaku Romantan - Tsuioku-hen,"{'medium': 'https://cdn.myanimelist.net/images/anime/1656/137618.webp', 'large': 'https://cdn.myanimelist.net/images/anime/1656/137618l.webp'}","When mankind's savagery surpasses his fear of death, there is little hope for those who wish to live honest lives. Beneath a full moon, a young boy witnesses the murder of the bandits who had enslaved him, and is then christened with a new name by the man who rescued him. This boy is Shinta, now known as Kenshin Himura, and he is destined to become a swordsman. The softness of his heart does not befit the occupation, but his desire to protect the innocent is absolute.

Rurouni Kenshin: Meiji Kenkaku Romantan - Tsuioku-hen details the origins of the man who would bear the name of Hitokiri Battousai long before he swore his oath not to kill and before he earned his reputation as an assassin. The young man's heart is divided between justice and corruption, while the fate of a nation rests on his actions.

[Written by MAL Rewrite]",8.7,61,915,286894,142006,1999-02-20,1999-09-22,ova,finished_airing,"['Action', 'Adult Cast', 'Drama', 'Historical', 'Romance', 'Samurai', 'Shounen']"
33095,Shouwa Genroku Rakugo Shinjuu: Sukeroku Futatabi-hen,"{'medium': 'https://cdn.myanimelist.net/images/anime/1493/124765.jpg', 'large': 'https://cdn.myanimelist.net/images/anime/1493/124765l.jpg'}","Even after having risen to the utmost rank of shin'uchi, Yotarou struggles to find his own identity in the world of rakugo. Caught between his master's teachings and the late Sukeroku's unique style, his performance lacks an important ingredient—ego. And while his popularity packs the theaters, he is but one of the few; rakugo is under threat of being eclipsed.

Meanwhile Yakumo, regarded by many as the last bastion of preserving the popularity of rakugo, struggles to cope with his elderly state. Even though his performances are still stellar, he fears that he is nearing his limits. His doubts grow stronger as an old friend creeps ever closer. Konatsu, for her part, attempts to raise her son as a single mother, which Yotarou is heavily opposed to. Instead, he seeks to persuade her to marry him and in turn raise her son as his own.

In Shouwa Genroku Rakugo Shinjuu: Sukeroku Futatabi-hen, the curtains fall on Yotarou and Yakumo's story, tasked with restoring the near-obsolete art form as well as overcoming their internal conflicts.

[Written by MAL Rewrite]",8.7,62,1327,196880,68140,2017-01-07,2017-03-25,tv,finished_airing,"['Adult Cast', 'Drama', 'Historical', 'Josei', 'Love Polygon', 'Performing Arts']"
